[
  {
    "id": "primary-doc-plovdiv-council-decision-58-2011",
    "type": "primary_document",
    "kind": "municipal_decision",
    "date": "2011-03-17",
    "date_year": 2011,
    "title_bg": "Решение №58 на Общински съвет — Пловдив",
    "title_en": "Plovdiv Municipal Council Decision No. 58",
    "summary_bg": "Решението приема отчета за изпълнението на сборния бюджет на Община Пловдив за 2010 г. и е използвано за архивния бюджетен ред за 2010 г.",
    "summary_en": "The decision accepts the report on Plovdiv Municipality's consolidated 2010 budget execution and supports the archive budget row for 2010.",
    "transcription": {
      "type": "excerpt",
      "original_language": "bg",
      "excerpt_bg": "Отчет за изпълнение на бюджета на Община Пловдив за 2010 г.",
      "excerpt_en": "Report on the execution of Plovdiv Municipality's 2010 budget.",
      "notes_bg": "Начална транскрипция на заглавния/предметен ред; пълният акт остава в публичния източник.",
      "notes_en": "Starter transcription of the heading/subject line; the full act remains in the public source."
    },
    "linked_event_ids": [],
    "linked_budget_item_ids": ["budget-plovdiv-2010-execution-total"],
    "linked_place_ids": ["place-plovdiv-city"],
    "linked_organization_ids": ["org-plovdiv-municipality", "org-plovdiv-municipal-council"],
    "source": {
      "title": "Общински съвет — Пловдив, Решение №58 за отчет на бюджет 2010",
      "url": "https://plovdiv.bg/obs/%d0%b4%d0%b5%d0%b9%d1%81%d1%82%d0%b2%d0%b0%d1%89%d0%b8-%d0%b0%d0%ba%d1%82%d0%be%d0%b2%d0%b5/%d1%80%d0%b5%d1%88%d0%b5%d0%bd%d0%b8%d0%b5-58-1/",
      "accessed_at": "2026-06-17",
      "license": {
        "status": "public_reference_terms_unverified",
        "label": "Public municipal council act; reuse terms not verified",
        "url": "https://plovdiv.bg/obs/"
      }
    },
    "data_quality": "public_source",
    "editorial": {
      "status": "needs_editorial_signoff",
      "reviewed_by": null,
      "reviewed_at": null,
      "notes_bg": "Изисква независим редакторски преглед и пълна транскрипция преди да се брои като завършен първичен документ.",
      "notes_en": "Requires independent editorial review and full transcription before it counts as a finished primary document."
    }
  },
  {
    "id": "primary-doc-state-gazette-pms-138-2010",
    "type": "primary_document",
    "kind": "state_gazette_decree",
    "date": "2010-07-15",
    "date_year": 2010,
    "title_bg": "Постановление №138 от 15 юли 2010 г.",
    "title_en": "Decree No. 138 of 15 July 2010",
    "summary_bg": "Постановлението одобрява допълнителни бюджетни кредити за инфраструктурни обекти в Пловдив, свързани с приемането на балирани отпадъци от София.",
    "summary_en": "The decree approves additional budget credits for Plovdiv infrastructure works linked to accepting baled waste from Sofia.",
    "transcription": {
      "type": "excerpt",
      "original_language": "bg",
      "excerpt_bg": "Одобрява допълнителни бюджетни кредити в размер 2 859 767 лв.",
      "excerpt_en": "Approves additional budget credits amounting to BGN 2,859,767.",
      "notes_bg": "Начална транскрипция на ключовия финансов диспозитив; пълният текст остава в Държавен вестник.",
      "notes_en": "Starter transcription of the key financial operative text; the full text remains in the State Gazette."
    },
    "linked_event_ids": ["event-programme-2010-waste-infrastructure-extra-credits"],
    "linked_budget_item_ids": [],
    "linked_place_ids": ["place-plovdiv-city"],
    "linked_organization_ids": ["org-plovdiv-municipality"],
    "source": {
      "title": "Държавен вестник — ПМС №138 от 15.07.2010 г.",
      "url": "https://dv.parliament.bg/DVWeb/showMaterialDV.jsp?idMat=35023",
      "accessed_at": "2026-06-17",
      "license": {
        "status": "public_reference_terms_unverified",
        "label": "Public State Gazette act; reuse terms not verified",
        "url": "https://dv.parliament.bg/"
      }
    },
    "data_quality": "public_source",
    "editorial": {
      "status": "needs_editorial_signoff",
      "reviewed_by": null,
      "reviewed_at": null,
      "notes_bg": "Изисква независим редакторски преглед и пълна транскрипция преди да се брои като завършен първичен документ.",
      "notes_en": "Requires independent editorial review and full transcription before it counts as a finished primary document."
    }
  },
  {
    "id": "primary-doc-plovdiv-gifted-children-rule-2010",
    "type": "primary_document",
    "kind": "municipal_rule",
    "date": "2010-07-08",
    "date_year": 2010,
    "title_bg": "Правилник за подпомагане на деца с изявени дарби",
    "title_en": "Rule for supporting children with exceptional talents",
    "summary_bg": "Правилникът урежда реда за отпускане и отчитане на средства за деца с изявени дарби в Община Пловдив.",
    "summary_en": "The rule defines the procedure for granting and reporting municipal support for children with exceptional talents in Plovdiv.",
    "transcription": {
      "type": "excerpt",
      "original_language": "bg",
      "excerpt_bg": "С този Правилник се определят реда, начина на отпускане",
      "excerpt_en": "This rule defines the procedure and method for granting support.",
      "notes_bg": "Начална транскрипция на откъс от чл. 1; пълният правилник остава в публичния източник.",
      "notes_en": "Starter transcription of an excerpt from Article 1; the full rule remains in the public source."
    },
    "linked_event_ids": ["event-programme-2010-gifted-children-support"],
    "linked_budget_item_ids": [],
    "linked_place_ids": ["place-plovdiv-city"],
    "linked_organization_ids": ["org-plovdiv-municipality", "org-plovdiv-municipal-council"],
    "source": {
      "title": "Общински съвет — Пловдив, Правилник за подпомагане на деца с изявени дарби",
      "url": "https://plovdiv.bg/obs/%D0%B4%D0%B5%D0%B9%D1%81%D1%82%D0%B2%D0%B0%D1%89%D0%B8-%D0%B0%D0%BA%D1%82%D0%BE%D0%B2%D0%B5/%D0%BF%D1%80%D0%B0%D0%B2%D0%B8%D0%BB%D0%BD%D0%B8%D0%BA-%D0%B7%D0%B0-%D0%BF%D0%BE%D0%B4%D0%BF%D0%BE%D0%BC%D0%B0%D0%B3%D0%B0%D0%BD%D0%B5-%D0%BD%D0%B0-%D0%B4%D0%B5%D1%86%D0%B0-%D1%81-%D0%B8%D0%B7%D1%8F/",
      "accessed_at": "2026-06-17",
      "license": {
        "status": "public_reference_terms_unverified",
        "label": "Public municipal council rule; reuse terms not verified",
        "url": "https://plovdiv.bg/obs/"
      }
    },
    "data_quality": "public_source",
    "editorial": {
      "status": "needs_editorial_signoff",
      "reviewed_by": null,
      "reviewed_at": null,
      "notes_bg": "Изисква независим редакторски преглед и пълна транскрипция преди да се брои като завършен първичен документ.",
      "notes_en": "Requires independent editorial review and full transcription before it counts as a finished primary document."
    }
  }
]
